{
  "schema_version": 1,
  "taxonomy_version": "2026-10-26.1",
  "review_method": "Automated source-led role classification; independent human review pending",
  "groups": [
    {
      "id": "firewalls",
      "name": "Firewalls and security gateways",
      "scope": "Appliance and virtual firewall software; deployment and feature equivalence unverified."
    },
    {
      "id": "switching",
      "name": "Switching platforms",
      "scope": "Products explicitly identified as switches or switch operating systems."
    },
    {
      "id": "routing",
      "name": "Routing and SD-WAN",
      "scope": "Products explicitly identified as routers or SD-WAN."
    },
    {
      "id": "routing_switching",
      "name": "Shared routing/switching operating systems",
      "scope": "Broad operating-system statements whose router/switch platform split is unresolved."
    },
    {
      "id": "wireless",
      "name": "Wireless infrastructure",
      "scope": "Access points and wireless controllers; not equivalent hardware inventories."
    },
    {
      "id": "management",
      "name": "Infrastructure management",
      "scope": "Management, orchestration and monitoring software; excludes the managed appliance itself."
    },
    {
      "id": "access_control",
      "name": "Network access control",
      "scope": "Policy and admission-control products."
    },
    {
      "id": "servers",
      "name": "Servers and HPC",
      "scope": "Server/platform software explicitly identified by the vendor."
    },
    {
      "id": "web_gateways",
      "name": "Secure web gateways",
      "scope": "Explicit proxy/gateway products; not equated to network firewalls."
    }
  ],
  "rules": [
    {
      "id": "paloalto-1",
      "vendor": "paloalto",
      "group": "firewalls",
      "prefix": "PAN-OS",
      "source_url": "https://www.paloaltonetworks.com/network-security",
      "reviewed_at": "2026-10-26",
      "rationale": "Firewall software family; Panorama and endpoint clients excluded."
    },
    {
      "id": "paloalto-2",
      "vendor": "paloalto",
      "group": "firewalls",
      "prefix": "Cloud NGFW",
      "source_url": "https://www.paloaltonetworks.com/network-security",
      "reviewed_at": "2026-10-26",
      "rationale": "Firewall software family; Panorama and endpoint clients excluded."
    },
    {
      "id": "paloalto-3",
      "vendor": "paloalto",
      "group": "management",
      "prefix": "Panorama",
      "source_url": "https://www.paloaltonetworks.com/network-security/panorama",
      "reviewed_at": "2026-10-26",
      "rationale": "Firewall management plane, separately scoped from managed firewalls."
    },
    {
      "id": "paloalto-4",
      "vendor": "paloalto",
      "group": "routing",
      "prefix": "Prisma SD-WAN",
      "source_url": "https://www.paloaltonetworks.com/sase/sd-wan",
      "reviewed_at": "2026-10-26",
      "rationale": "Explicit SD-WAN product family."
    },
    {
      "id": "fortinet-5",
      "vendor": "fortinet",
      "group": "firewalls",
      "prefix": "FortiOS",
      "source_url": "https://www.fortinet.com/products",
      "reviewed_at": "2026-10-26",
      "rationale": "FortiOS firewall OS and FortiProxy secure web gateway; product differences remain visible."
    },
    {
      "id": "fortinet-6",
      "vendor": "fortinet",
      "group": "web_gateways",
      "prefix": "FortiProxy",
      "source_url": "https://docs.fortinet.com/fortiproxy/7.2.7",
      "reviewed_at": "2026-10-26",
      "rationale": "Secure web proxy family, separately scoped from FortiOS firewalls."
    },
    {
      "id": "fortinet-7",
      "vendor": "fortinet",
      "group": "management",
      "prefix": "FortiManager",
      "source_url": "https://www.fortinet.com/products",
      "reviewed_at": "2026-10-26",
      "rationale": "Management and analysis products, including named cloud/version variants."
    },
    {
      "id": "fortinet-8",
      "vendor": "fortinet",
      "group": "management",
      "prefix": "FortiAnalyzer",
      "source_url": "https://www.fortinet.com/products",
      "reviewed_at": "2026-10-26",
      "rationale": "Management and analysis products, including named cloud/version variants."
    },
    {
      "id": "fortinet-9",
      "vendor": "fortinet",
      "group": "switching",
      "prefix": "FortiSwitch",
      "source_url": "https://www.fortinet.com/products/ethernet-switches",
      "reviewed_at": "2026-10-26",
      "rationale": "Switching family; manager mapping is intentionally excluded below pending role review."
    },
    {
      "id": "fortinet-10",
      "vendor": "fortinet",
      "group": "wireless",
      "prefix": "FortiAP",
      "source_url": "https://www.fortinet.com/products/wireless-access-points",
      "reviewed_at": "2026-10-26",
      "rationale": "Access point family."
    },
    {
      "id": "fortinet-11",
      "vendor": "fortinet",
      "group": "access_control",
      "prefix": "FortiNAC",
      "source_url": "https://www.fortinet.com/products/network-access-control",
      "reviewed_at": "2026-10-26",
      "rationale": "NAC products; OS qualifiers are retained."
    },
    {
      "id": "fortinet-12",
      "vendor": "fortinet",
      "group": "access_control",
      "prefix": "FortiNAC-F",
      "source_url": "https://www.fortinet.com/products/network-access-control",
      "reviewed_at": "2026-10-26",
      "rationale": "NAC products; OS qualifiers are retained."
    },
    {
      "id": "aruba-13",
      "vendor": "aruba",
      "group": "switching",
      "prefix": "AOS-CX",
      "source_url": "https://www.arubanetworks.com/products/switches/",
      "reviewed_at": "2026-10-26",
      "rationale": "Explicit switch operating systems and switch family."
    },
    {
      "id": "aruba-14",
      "vendor": "aruba",
      "group": "switching",
      "prefix": "ArubaOS-CX",
      "source_url": "https://www.arubanetworks.com/products/switches/",
      "reviewed_at": "2026-10-26",
      "rationale": "Explicit switch operating systems and switch family."
    },
    {
      "id": "aruba-15",
      "vendor": "aruba",
      "group": "switching",
      "prefix": "ArubaOS-CX 8000",
      "source_url": "https://www.arubanetworks.com/products/switches/",
      "reviewed_at": "2026-10-26",
      "rationale": "Explicit switch operating systems and switch family."
    },
    {
      "id": "aruba-16",
      "vendor": "aruba",
      "group": "switching",
      "prefix": "AOS-S",
      "source_url": "https://www.arubanetworks.com/products/switches/",
      "reviewed_at": "2026-10-26",
      "rationale": "Explicit switch operating systems and switch family."
    },
    {
      "id": "aruba-17",
      "vendor": "aruba",
      "group": "switching",
      "prefix": "ArubaOS-Switch",
      "source_url": "https://www.arubanetworks.com/products/switches/",
      "reviewed_at": "2026-10-26",
      "rationale": "Explicit switch operating systems and switch family."
    },
    {
      "id": "aruba-18",
      "vendor": "aruba",
      "group": "switching",
      "prefix": "1930 Switch Series",
      "source_url": "https://www.arubanetworks.com/products/switches/",
      "reviewed_at": "2026-10-26",
      "rationale": "Explicit switch operating systems and switch family."
    },
    {
      "id": "aruba-19",
      "vendor": "aruba",
      "group": "management",
      "prefix": "Aruba AirWave Management Platform",
      "source_url": "https://www.arubanetworks.com/products/network-management-operations/",
      "reviewed_at": "2026-10-26",
      "rationale": "Management and orchestration products; deployment qualifiers remain."
    },
    {
      "id": "aruba-20",
      "vendor": "aruba",
      "group": "management",
      "prefix": "Aruba Airwave Management Platform",
      "source_url": "https://www.arubanetworks.com/products/network-management-operations/",
      "reviewed_at": "2026-10-26",
      "rationale": "Management and orchestration products; deployment qualifiers remain."
    },
    {
      "id": "aruba-21",
      "vendor": "aruba",
      "group": "management",
      "prefix": "AirWave Management Platform",
      "source_url": "https://www.arubanetworks.com/products/network-management-operations/",
      "reviewed_at": "2026-10-26",
      "rationale": "Management and orchestration products; deployment qualifiers remain."
    },
    {
      "id": "aruba-22",
      "vendor": "aruba",
      "group": "management",
      "prefix": "Aruba Central",
      "source_url": "https://www.arubanetworks.com/products/network-management-operations/",
      "reviewed_at": "2026-10-26",
      "rationale": "Management and orchestration products; deployment qualifiers remain."
    },
    {
      "id": "aruba-23",
      "vendor": "aruba",
      "group": "management",
      "prefix": "Aruba EdgeConnect Enterprise Orchestrator",
      "source_url": "https://www.arubanetworks.com/products/network-management-operations/",
      "reviewed_at": "2026-10-26",
      "rationale": "Management and orchestration products; deployment qualifiers remain."
    },
    {
      "id": "aruba-24",
      "vendor": "aruba",
      "group": "access_control",
      "prefix": "Aruba ClearPass Policy Manager",
      "source_url": "https://www.arubanetworks.com/products/security/network-access-control/",
      "reviewed_at": "2026-10-26",
      "rationale": "ClearPass NAC family."
    },
    {
      "id": "aruba-25",
      "vendor": "aruba",
      "group": "access_control",
      "prefix": "ClearPass Policy Manager",
      "source_url": "https://www.arubanetworks.com/products/security/network-access-control/",
      "reviewed_at": "2026-10-26",
      "rationale": "ClearPass NAC family."
    },
    {
      "id": "aruba-26",
      "vendor": "aruba",
      "group": "routing",
      "prefix": "Aruba EdgeConnect Enterprise",
      "source_url": "https://www.arubanetworks.com/products/sd-wan/",
      "reviewed_at": "2026-10-26",